{"schema_version":2,"id":"en-1075-reclaim-mental-space-from-family-small-decisions","article_number":1075,"translation_group":"1075-reclaim-mental-space-from-family-small-decisions","language":"en","locale":"en-US","market_context":"U.S./Canada audience; motherhood, family organization, and mental-load content without diagnosis or treatment advice.","title":"How to reclaim mental space when your family depends on you for every small decision","slug":"reclaim-mental-space-from-family-small-decisions","seo":{"title":"Reclaim mental space from endless small family decisions","meta_description":"If your head is full of tiny decisions about clothes, food, schedules, and logistics, reduce the load with defaults, shared ownership, and fewer repeated questions.","search_intent":"Give mothers practical ways to reduce the mental load created by many small family decisions throughout the day."},"excerpt":"A single choice rarely feels exhausting. Thirty tiny choices before lunch can. What to wear, what to bring, what snack, where something is, who picks up whom, and what happens next can fill the whole day with invisible decision-making.","taxonomy":{"topic":{"primary":"motherhood-identity","terms":["motherhood-identity"]},"stage":{"primary":"parenthood-general","terms":["parenthood-general"]},"audience":{"primary":"mothers","terms":["mothers"]},"article_type":{"primary":"how-to","terms":["how-to"]}},"content_html":"<p>One decision is tiny. “What snack should I give them?” “Do they need a jacket?” “Which shirt?” “What are we doing after this?” The problem is when your brain becomes the landing place for all of them, one after another, all day long.</p><p><strong>Reclaiming mental space does not always require removing huge responsibilities. Sometimes it begins by reducing how many microdecisions have to pass through you.</strong></p><h2>Create defaults for decisions that repeat</h2><p>Many family questions do not need fresh creativity every day. You can have a few regular snacks, one home for school papers, a standard morning sequence, a simple weather rule for outerwear, or a stable way to decide who handles recurring tasks.</p><p>Defaults are not the same as rigidity. They save attention on choices that do not deserve a brand-new mental meeting every time. If today requires something different, change it. Otherwise, use the ordinary option.</p><p>Defaults also help other people. Once the system exists outside your head, family members no longer need to ask you for the “right” answer every time.</p><h2>Return small decisions to the person who can make them</h2><p>Children can choose between two outfits, select which book to bring, or pick between two available snacks. Another adult can choose what to buy for a dinner they own or decide what activity to do with the kids without asking you to approve the whole plan.</p><p><strong>Handing over the decision is different from offering choices and then grading whether the other person chose correctly.</strong> If the result is reasonable, letting it stand is part of getting your mental space back.</p><p>Some choices may be less efficient or less aesthetically pleasing than yours. That small cost may be worth not remaining the permanent filter for everything.</p><h2>Batch decisions that otherwise chase you all day</h2><p>Some topics genuinely need your input, but they do not need access to you at any moment. You can plan meals in one session, review the calendar at a set time, or discuss family logistics during a regular check-in instead of answering scattered questions from morning to night.</p><p>A shared list can absorb reminders too. If something runs out, it goes on the list. If an item needs to go to school Friday, it goes on the calendar. The goal is not a perfect productivity system. It is to stop every reminder from surviving only because you keep it active in your head.</p><h2>Mental space appears when some moments contain no decisions</h2><p>It is easy to turn every pause into administration: deciding groceries while coffee brews, planning the weekend in the shower, answering school messages while watching a show. The brain never gets a genuinely empty stretch.</p><p>Protect some moments from nonurgent decisions. If a question can wait twenty minutes, let it wait. If another adult can solve it, do not keep it pending in your own head.</p><p><strong>Reclaiming mental space does not mean thinking less about your family. It means your attention stops being the required birthplace of every tiny family decision.</strong></p>","faq":[{"question":"What are microdecisions in the mental load?","answer":"They are small repeated choices about food, clothing, schedules, objects, permissions, and logistics. Each one may be easy, but together they consume a large amount of attention."},{"question":"How can I reduce small decisions without making family life rigid?","answer":"Use defaults for recurring situations and change them when there is a real reason. A default removes unnecessary decisions without eliminating flexibility."},{"question":"What should I delegate first?","answer":"Start with low-risk choices another person can fully own, such as a snack, outfit, simple outing, or purchasing connected to a responsibility they already handle."}],"sources":[],"image":{"concept":"Mother at a family table with a shared list while other family members choose between simple options without consulting her, organized realistic home scene, no text.","alt":"Family members making small choices without routing every decision through Mom"},"status":"publish"}
