{"schema_version":2,"id":"es-1134-no-querer-que-toquen-barriga-embarazo","article_number":1134,"translation_group":"1134-not-want-people-touch-pregnant-belly","language":"es","locale":"es-ES","market_context":"Audiencia hispanohablante; consentimiento y contacto físico durante embarazo.","title":"No querer que otras personas toquen tu barriga durante el embarazo","slug":"no-querer-que-toquen-barriga-embarazo","seo":{"title":"No querer que otras personas toquen tu barriga durante el embarazo","meta_description":"Estar embarazada no elimina tu derecho a decidir quién te toca. Pon límites claros sin sentir que debes justificar cada no.","search_intent":"Normalizar y apoyar límites de contacto físico durante el embarazo."},"excerpt":"No querer que te toquen la barriga no requiere una explicación especial. El embarazo no convierte el contacto físico en algo automáticamente compartido.","taxonomy":{"topic":{"primary":"pregnancy-preparation","terms":["pregnancy-preparation"]},"stage":{"primary":"pregnancy","terms":["pregnancy"]},"audience":{"primary":"mothers","terms":["mothers"]},"article_type":{"primary":"communication-boundaries","terms":["communication-boundaries","emotions-identity"]}},"content_html":"<p>El embarazo puede crear un atajo social extraño: alguien ve una barriga visible y acerca la mano como si las reglas habituales sobre el espacio personal hubieran cambiado. A veces pregunta. Otras veces la mano ya está ahí antes de que tú hayas podido decidir cómo te sientes. Quizá te guste el contacto de algunas personas y no el de otras, o simplemente hoy no te apetezca que te toque nadie.</p><p><strong>No necesitas una razón especial relacionada con el embarazo para preferir que no haya contacto.</strong> La regla básica sigue siendo la misma que en cualquier otro momento: tu cuerpo es tuyo y el cariño, la curiosidad o la ilusión no sustituyen tu permiso.</p><h2>Tu consentimiento puede ser específico y cambiar según el momento</h2><p>No hace falta adoptar una postura de “nadie me toca nunca” para que tus límites sean válidos. Puedes disfrutar de que tu pareja toque la barriga y decir que no a una compañera de trabajo. Puedes aceptar la mano de una amiga una semana y sentirte saturada de contacto la siguiente. Incluso después de haber dicho que sí, puedes apartarte si ya has tenido suficiente.</p><p>Esta flexibilidad importa porque a veces un sí anterior se interpreta como una invitación permanente. “La otra vez me dejaste” no te obliga a repetirlo. Una preferencia puede cambiar sin que tengas que construir una explicación importante alrededor.</p><p>También ayuda quitarle carga moral a la decisión. Querer espacio no significa ser fría, desagradecida ni estar menos conectada con el bebé. Solo describe cómo quieres relacionarte físicamente con otras personas en ese momento.</p><h2>Haz más fácil responder antes de quedarte sorprendida</h2><p>Cuando alguien acerca la mano de repente es común quedarse bloqueada o reír por inercia. Después quizá te enfadas contigo misma por no haber dicho lo que querías, aunque en realidad estabas reaccionando a una situación inesperada.</p><p>Si ocurre a menudo, prepara tanto una frase como un movimiento. Puedes dar medio paso atrás, girar ligeramente el cuerpo, colocar tu propia mano sobre la barriga o saludar de otra manera. Acompáñalo con algo sencillo: “pregúntame antes, por favor”, “hoy prefiero que no me toquen” o “no me apetece contacto”.</p><p>Tenerlo preparado no significa esperar una pelea. Solo reduce las decisiones que tienes que tomar bajo presión. Una frase conocida sale con más facilidad cuando te pillan por sorpresa.</p><h2>Mantén la conversación centrada en el permiso, no en la intención</h2><p>La otra persona puede responder “solo quería darte cariño” o “quería sentir al bebé”. Puedes creer que su intención era buena y seguir sin querer ese contacto. Las dos cosas son compatibles.</p><p>Una respuesta como “lo sé, pero prefiero que me preguntes antes” devuelve la conversación al punto importante. No necesitas demostrar que alguien actuó con mala intención. No se trata de castigarlo, sino de dejar claro qué necesitas antes de que vuelva a ocurrir.</p><p>Si la persona se disculpa, puedes aceptar la disculpa sin tranquilizarla tanto que tu límite desaparezca. Un “gracias por entenderlo” suele ser suficiente.</p><h2>Un no claro no tiene que suavizarse hasta convertirse en quizá</h2><p>Algunas personas negocian después de oír un límite: “solo un segundo”, “hace mucho que no te veo” o “pero si somos familia”. Si sigues añadiendo razones cada vez más suaves, puedes acabar discutiendo un acceso que en realidad no querías negociar.</p><p>Puedes repetir la misma respuesta. Si alguien continúa después de que ya has dicho que no, apartarte, terminar la interacción o pedir apoyo a otra persona es razonable. Ser más firme no es falta de educación cuando una petición anterior se ha ignorado.</p><p>Tampoco estás obligada a mantener el límite exactamente igual para siempre. Si otro día quieres invitar a alguien a sentir un movimiento, puedes hacerlo. Elegir tú el contacto es diferente de que alguien lo dé por supuesto.</p><p><strong>El embarazo puede hacer tu barriga más visible, pero visible no significa compartida. Sigues decidiendo quién te toca, cuándo y en qué condiciones.</strong></p>","faq":[{"question":"¿Es raro no querer que me toquen la barriga?","answer":"No. Las preferencias de contacto físico varían mucho."},{"question":"¿Puedo dejar que algunas personas sí y otras no?","answer":"Sí. El consentimiento puede ser diferente según persona y momento."},{"question":"¿Qué puedo decir?","answer":"“Prefiero que me preguntes antes de tocarme” es una opción clara."}],"sources":[],"image":{"concept":"Mujer embarazada manteniendo espacio personal con un gesto amable de la mano, escena respetuosa, sin texto.","alt":"Mujer embarazada marcando un límite de espacio personal"},"status":"publish"}