{"schema_version":2,"id":"es-1150-mantener-identidad-mientras-estas-embarazada","article_number":1150,"translation_group":"1150-maintain-identity-during-pregnancy","language":"es","locale":"es-ES","market_context":"Audiencia hispanohablante; continuidad de identidad durante el embarazo.","title":"Cómo mantener otras partes de tu identidad mientras estás embarazada","slug":"mantener-identidad-mientras-estas-embarazada","seo":{"title":"Cómo mantener tu identidad mientras estás embarazada","meta_description":"Haz sitio a trabajo, amistades, intereses, pareja y tiempo propio durante el embarazo sin exigir que todo siga exactamente igual que antes.","search_intent":"Ayudar a embarazadas a conservar conexión con otras partes de su identidad durante el embarazo."},"excerpt":"No necesitas elegir entre involucrarte en el embarazo y seguir siendo tú. La identidad puede ampliarse sin que cada interés anterior desaparezca para hacer sitio al bebé.","taxonomy":{"topic":{"primary":"pregnancy-preparation","terms":["pregnancy-preparation"]},"stage":{"primary":"pregnancy","terms":["pregnancy"]},"audience":{"primary":"mothers","terms":["mothers"]},"article_type":{"primary":"how-to","terms":["how-to","emotions-identity"]}},"content_html":"<p>El embarazo puede ocupar una cantidad enorme de espacio físico, mental y logístico. Hay citas, decisiones, cambios corporales, conversaciones, compras, planes y un futuro que de repente parece mucho más cercano. Es lógico que durante algunos periodos tenga un peso enorme. La dificultad aparece cuando todas las demás partes de ti empiezan a sentirse aparcadas hasta después del nacimiento.</p><p><strong>Mantener tu identidad no significa fingir que el embarazo no ha cambiado nada.</strong> Significa permitir que tu vida se amplíe alrededor de un papel nuevo sin exigir que desaparezcan los vínculos, intereses, valores y proyectos que ya formaban parte de ti.</p><h2>Elige algunas continuidades en lugar de intentar conservar tu vida anterior intacta</h2><p>Quizá no tengas la misma energía, horario, cuerpo o apetito social que antes. Intentar reproducir exactamente tu rutina anterior puede convertir la identidad en otra prueba de rendimiento. Suele ser más realista elegir unas pocas cosas que te hacen sentir reconocible para ti misma.</p><p>Puede ser una amistad que proteges, un proyecto laboral que te importa, una afición creativa, tiempo a solas, leer, salir una vez por semana o conversar con tu pareja sobre temas que no tengan que ver con la logística del bebé. Pequeñas continuidades pueden sostener mucho porque conectan a la persona actual con quien eras antes del embarazo.</p><p>La pregunta no necesita ser “¿cómo mantengo todo?”. Puede ser más útil: “¿Qué parte de mi vida echaría más de menos si desapareciera por completo durante los próximos meses?”. Empieza por ahí.</p><h2>Deja que las partes importantes de ti cambien de forma</h2><p>Continuidad no significa idéntica intensidad. Una salida larga puede convertirse en un café corto. Una afición puede necesitar otro ritmo. Una meta profesional puede seguir siendo importante aunque temporalmente avances más despacio. Una relación puede mantenerse aunque os veáis con menos frecuencia.</p><p>Esto importa porque a veces interpretamos la adaptación como una pérdida: “ya no hago esto como antes, así que quizá esa parte de mí haya desaparecido”. Muchas veces no ha desaparecido; simplemente está funcionando bajo condiciones nuevas.</p><p>Darte permiso para ampliar o reducir actividades según el momento puede conservarlas mejor que un criterio de todo o nada. No tienes que demostrar quién eres manteniendo cada hábito anterior a máxima intensidad.</p><h2>Protege relaciones y conversaciones que recuerden algo más que el embarazo</h2><p>Mantente cerca de personas con las que todavía puedes hablar de ideas, trabajo, cultura, humor, familia, hobbies y problemas cotidianos. Si cada interacción vuelve al embarazo, crea deliberadamente espacios donde ese tema sea opcional y no la pregunta obligatoria de apertura.</p><p>Tú también puedes ayudar a dar forma a esos vínculos sacando otras partes de ti a la conversación. Cuenta lo que estás leyendo, pide opinión sobre un proyecto, haz un plan alrededor de un interés compartido o dile a una amiga: “También quiero saber qué está pasando en tu vida”. La identidad se sostiene participando, no solo recordándote en privado que sigue existiendo.</p><p>La pareja puede necesitar algo parecido. Los preparativos convierten con facilidad a dos personas en gestores de un proyecto. Tener ratos juntos sin listas, compras ni decisiones ayuda a conservar la relación que existía antes de convertiros en futuros padres.</p><h2>No conviertas “seguir siendo tú” en otro estándar que puedes incumplir</h2><p>Habrá semanas en las que el embarazo utilice de verdad casi toda tu energía. Puede que canceles planes, pierdas interés por una afición, pienses constantemente en el bebé o solo tengas capacidad para lo básico. Eso no significa que tu identidad haya desaparecido.</p><p>Hay partes de ti que pueden quedarse más silenciosas sin dejar de existir. Una carrera sigue importando durante una etapa lenta. Una amistad conserva valor aunque haya menos contacto. Una afición puede esperar sin quedar abandonada. La identidad no se mide únicamente por cuántas horas dedicas activamente a demostrar cada una de sus partes.</p><p>La meta no es demostrar que el embarazo no puede cambiarte. El cambio ya está ocurriendo y la maternidad probablemente añadirá otros. Se trata de atravesarlo sin aceptar la idea de que convertirse en madre exige sustituir a la persona que ya estaba ahí. Tu identidad puede hacerse más amplia, no necesariamente más pequeña.</p>","faq":[{"question":"¿Y si ahora no tengo energía para mis aficiones?","answer":"No significa que hayas perdido esa parte de ti. Puedes mantener una conexión pequeña o simplemente dejar la puerta abierta para retomarla."},{"question":"¿Mantener mi identidad implica priorizarme siempre?","answer":"No. Se trata de reservar algún espacio para tus relaciones, intereses y valores dentro de una etapa que también requiere adaptación."},{"question":"¿Es normal sentir que el embarazo ocupa toda mi cabeza algunas semanas?","answer":"Sí. La intensidad puede cambiar por etapas; eso no convierte esa sensación temporal en una pérdida definitiva de identidad."}],"sources":[],"image":{"concept":"Mujer embarazada combinando una actividad personal que disfruta con su vida cotidiana, por ejemplo leyendo o trabajando en un proyecto, sin texto.","alt":"Mujer embarazada manteniendo intereses propios durante el embarazo"},"status":"publish"}