{"schema_version":2,"id":"en-1063-relief-when-no-one-needs-you","article_number":1063,"translation_group":"1063-relief-when-no-one-needs-you","language":"en","locale":"en-US","market_context":"U.S./Canada English-speaking audience; maternal emotional experience, constant availability, and rest, non-diagnostic and non-treatment-focused.","title":"Feeling relieved when no one needs you for a few minutes","slug":"relief-when-no-one-needs-you","seo":{"title":"Feeling relieved when no one needs you for a few minutes","meta_description":"That relief when nobody is asking anything of you does not mean you reject your family. It may be the feeling of finally going off duty after hours of being available.","search_intent":"Support mothers who feel guilty about the relief they experience when, for a few minutes, no one depends on them."},"excerpt":"Sometimes rest does not begin when you sit down. It begins when you realize that for a few minutes, nobody’s next step depends on you. Relief can come from going off duty, not from wanting to stop mattering to the people you love.","taxonomy":{"topic":{"primary":"motherhood-identity","terms":["motherhood-identity"]},"stage":{"primary":"parenthood-general","terms":["parenthood-general"]},"audience":{"primary":"mothers","terms":["mothers"]},"article_type":{"primary":"emotions-identity","terms":["emotions-identity"]}},"content_html":"<p>It can happen in a very ordinary moment: the kids are occupied with someone else, nobody is calling your name from another room, and for a few minutes there is no question aimed at you. The relief can feel surprisingly large compared with how small the moment looks from the outside.</p><p>That feeling may make you uneasy because it can sound like, ‘thank goodness they do not need me.’ <strong>But often what is resting is not the relationship. What is resting is the feeling that you are permanently on call.</strong></p><h2>Being needed can feel meaningful and exhausting at the same time</h2><p>Your children looking for you can feel tender, important, and deeply connecting. It can also mean that part of your attention stays open in case you need to respond. Even while sitting down, you may be listening for crying, remembering what someone needs tomorrow, or expecting to be interrupted.</p><p>That is why there is a difference between not actively doing a task and not being responsible for what happens in the next five minutes. The second state is often much rarer.</p><p>When another adult knows where things are, can handle a conflict, make a snack, or answer a question without checking with you, your body may notice before your mind does: the vigilance drops.</p><h2>Relief does not mean you want to stop mattering</h2><p>One emotional trap of motherhood is confusing ‘I like being important to my children’ with ‘I want to be necessary every second.’ Those are not the same thing.</p><p>You can want to be a central source of safety and love and still want some needs to find another route. A child going to another parent, caregiver, or increasingly solving something independently does not automatically weaken your bond.</p><p><strong>You do not have to be the only doorway into family security to prove that you matter.</strong></p><h2>Notice which kinds of needs drain you most</h2><p>Sometimes the heaviest load is not the major emergencies. It is the stream of tiny questions: where is the water bottle, which shirt should I wear, what is for snack, can I use this, what are we doing tomorrow? Each request lasts seconds, but together they keep your brain in response mode.</p><p>Seeing that pattern makes it easier to ask for specific changes. Maybe your partner needs to stop asking how to do tasks they can also decide. Maybe more child-accessible systems would remove routine questions. Maybe a few recurring choices can be standardized so they no longer have to travel through you.</p><p>The goal is not a family that never needs you. It is a family where not everything requires your intervention in order to move forward.</p><h2>You are allowed to rest from being indispensable</h2><p>There is a big difference between receiving help and no longer coordinating the help. Someone can cook dinner while asking you every three minutes what to do next; your hands may rest while your mind remains in charge.</p><p>The most restorative moments are often the ones where another person owns the whole loop and you know you do not have to supervise. That is when ‘no one needs me right now’ becomes real.</p><p><strong>Feeling relief in that moment is not a failure of love. It may be the first sign of actual rest after many hours of being the point where everyone else’s needs converge.</strong></p>","faq":[{"question":"Is it normal to feel relieved when no one needs me?","answer":"Yes. The relief may come from finally dropping your constant attention and availability after many hours. It does not mean you do not want to matter to your family."},{"question":"Why does rest not feel restful if I am still keeping track of everything?","answer":"Because not doing a task and not being responsible are different. If you are still anticipating, supervising, or answering questions, part of the load is still active."},{"question":"How can I stop being the person everyone asks about everything?","answer":"Share full responsibilities, make some routine decisions more automatic, and let other adults complete tasks without checking each step with you. The goal is to stop every small decision from routing through one person."}],"sources":[],"image":{"concept":"Mother sitting calmly while another adult handles the children in the background without asking her for anything, visible sense of relief, realistic everyday home, no text.","alt":"Mother resting while another adult handles family needs"},"status":"publish"}