{"schema_version":2,"id":"es-1088-necesitar-empezar-cero-cada-manana-hijos","article_number":1088,"translation_group":"1088-need-to-start-over-every-morning-with-kids","language":"es","locale":"es-ES","market_context":"Audiencia hispanohablante; experiencia emocional de la maternidad, enfoque no diagnóstico y no terapéutico.","title":"Sentir que necesitas empezar de cero cada mañana con tus hijos","slug":"necesitar-empezar-cero-cada-manana-hijos","seo":{"title":"Cuando sientes que cada mañana tienes que empezar de cero","meta_description":"Por qué después de un día difícil puedes sentir que necesitas reiniciar toda tu maternidad y cómo usar la mañana como continuidad, no como examen de recuperación.","search_intent":"Ayudar a madres que sienten que cada mañana deben compensar el día anterior a entender que la relación continúa y no necesita un reinicio perfecto."},"excerpt":"Después de una tarde mala, la mañana siguiente puede sentirse como una oportunidad y una obligación: hoy sí voy a hacerlo bien. Pero tratar cada amanecer como un reinicio total mantiene la sensación de que la relación se rompe cada vez que un día sale mal.","taxonomy":{"topic":{"primary":"motherhood-identity","terms":["motherhood-identity"]},"stage":{"primary":"parenthood-general","terms":["parenthood-general"]},"audience":{"primary":"mothers","terms":["mothers"]},"article_type":{"primary":"emotions-identity","terms":["emotions-identity","understanding"]}},"content_html":"<p>Después de una tarde de gritos, prisas o poca conexión, la mañana siguiente puede adquirir un peso enorme. “Hoy empezamos de cero” suena esperanzador, pero a veces esconde otra idea: hoy tengo que demostrar que puedo hacerlo bien y compensar lo de ayer.</p><p><strong>La relación con tus hijos no se borra cada noche y vuelve a crearse al despertar. Continúa: conserva lo bueno, lo difícil, lo que ya reparaste y lo que todavía merece una conversación.</strong></p><h2>El reinicio total convierte una mañana normal en un examen</h2><p>Si hoy tiene que corregir ayer, cualquier tropiezo temprano se vuelve demasiado importante. Un niño protesta al vestirse y enseguida aparece “otra vez estamos igual”. Llegáis tarde y parece que el nuevo comienzo ya ha fracasado antes de las nueve.</p><p>El problema no es querer una mañana distinta. Es exigirle que pruebe algo sobre toda tu maternidad. Las mañanas siguen teniendo sueño, desayunos, objetos perdidos, prisas y niños con estados de ánimo propios. No pueden sostener el papel de jornada perfecta de recuperación.</p><p>Cuando reduces esa exigencia, un momento difícil deja de cancelar el resto. Puedes tener un desayuno caótico y aun así hablar mejor durante la salida, reparar algo de ayer o simplemente continuar con el día.</p><h2>Continuar permite recordar sin quedarse atrapada en el pasado</h2><p>No hace falta fingir que ayer no ocurrió. Si hablaste de una manera que quieres reparar, puedes decirlo hoy. Si una rutina falló, puedes ajustar una parte. La continuidad incluye memoria, pero no obliga a convertir esa memoria en deuda.</p><p>Esto es distinto de compensar. Reparar atiende a una escena concreta; compensar intenta producir suficientes momentos buenos para borrar uno malo. El segundo enfoque mantiene la sensación de que la relación se rompe y hay que ganársela otra vez.</p><p>Los vínculos familiares son acumulativos. Se construyen con miles de desayunos, despedidas, conversaciones, límites, errores y regresos. Un día difícil entra en esa historia; no obliga a empezar una historia nueva.</p><h2>Usa la mañana para una acción nueva, no para una identidad nueva</h2><p>Puede ser útil aprovechar el siguiente día para probar algo distinto, siempre que el cambio tenga tamaño real. “Hoy seré una madre completamente paciente” es imposible de ejecutar. “Hoy voy a preparar la mochila antes del desayuno” o “si noto que me saturo, pediré relevo antes” sí son acciones observables.</p><p>Una acción concreta también puede sobrevivir a la imperfección. Si el resto de la mañana sale regular, no invalida el ajuste. Puedes evaluar después si ayudó y modificarlo sin declarar que el intento entero fracasó.</p><p>Esta escala protege de la lógica de todo o nada: ayer mala madre, hoy madre nueva; ayer caos, hoy perfección. La vida real casi siempre mejora mediante continuidad y pequeñas correcciones, no mediante transformaciones nocturnas.</p><h2>No necesitas volver a ganarte tu lugar cada día</h2><p>A veces la necesidad de “empezar bien” se parece a tener que demostrar cariño, paciencia o competencia cada mañana. Pero tus hijos no hacen un balance nocturno y deciden si la relación sigue existiendo según la nota de la jornada. La relación ya está ahí, incluso después de momentos que no te gustaron.</p><p>Puedes comenzar el día con una frase más modesta: “ayer hubo algo difícil; hoy seguimos”. Si hace falta, reparas. Si aprendiste algo, lo aplicas. Si no hay nada concreto pendiente, no necesitas fabricar una tarea de redención.</p><p><strong>La mañana no tiene que ser una hoja en blanco. Puede ser la siguiente página: conectada con lo anterior, suficientemente abierta para hacer algo diferente y sin la obligación de demostrar desde cero que mereces ser la madre de tus hijos.</strong></p>","faq":[{"question":"¿Está mal pensar que mañana será un nuevo día?","answer":"No. Puede ser esperanzador. El problema aparece si el nuevo día se convierte en una obligación de compensar o demostrar que ahora sí harás todo bien."},{"question":"¿Cómo puedo empezar diferente sin exigir un reinicio total?","answer":"Elige una acción concreta para ajustar y deja que el resto del día siga siendo normal e imperfecto."}],"sources":[],"image":{"concept":"Madre preparando un desayuno cotidiano a la mañana siguiente de un día difícil, conectando con su hijo sin escena idealizada, luz suave, sin texto.","alt":"Madre viviendo la mañana como continuidad y no como un reinicio perfecto"},"status":"publish"}