{"schema_version":2,"id":"en-132-short-naps-organize-rest-of-day","article_number":132,"translation_group":"132-short-naps-organize-rest-of-day","language":"en","locale":"en-US","market_context":"US/Canada parents; organizing family life after short naps.","title":"Short naps: how to organize the rest of the day without going into rescue mode","slug":"short-naps-organize-rest-of-day","seo":{"title":"Short naps: how to organize the rest of the day","meta_description":"What to do after a short nap without turning the afternoon into a chain of attempts to rescue lost sleep.","search_intent":"Help parents organize the day after a baby or toddler takes a short nap."},"excerpt":"A short nap can change the day without requiring a total rebuild. Fewer decisions and a lighter afternoon often help more than chasing sleep.","taxonomy":{"topic":{"primary":"sleep","terms":["sleep"]},"stage":{"primary":"baby","terms":["baby","toddler"]},"audience":{"primary":"parents","terms":["parents"]},"article_type":{"primary":"routine-organization","terms":["routine-organization","how-to"]}},"content_html":"<p>A twenty- or thirty-minute nap can make the family plan feel as if it has collapsed. The natural impulse is to extend the nap, resettle the child, move everything earlier, and cancel the afternoon.</p><p><strong>A short nap does not have to become a logistical emergency. You can adjust the rest of the day without trying to replace every missed minute.</strong></p><h2>Decide what truly needs to change</h2><p>Not every part of the day is affected. Sometimes shortening an outing, simplifying a meal, or offering rest a little earlier is enough.</p><p>Before moving everything, ask which part of the afternoon is actually likely to be hard. That question reduces decisions and keeps a small disruption from becoming an entirely new schedule.</p><h2>Keep a lighter version of the afternoon</h2><p>A flexible plan absorbs unpredictable sleep better than a minute-by-minute schedule. It can help to have a low-effort version ready: familiar food, fewer errands, calm play, and an earlier wind-down if tiredness calls for it.</p><p>This is not a punishment for a bad nap or a permanent routine. It is simply a way to lower demand when your child's margin is smaller.</p><h2>Do not chase sleep for hours</h2><p>Trying to extend the nap, walking, driving, resettling, and repeating can consume more family energy than it returns. Set a practical limit on rescue attempts.</p><p>If they do not work, change the goal. You are no longer fixing the nap; you are supporting a more tired afternoon with less friction.</p><h2>Judge the pattern, not today</h2><p>One short nap says little. If short naps persist and make most days difficult, then the larger routine may be worth reviewing.</p><p><strong>The useful question is whether your child and family can move through most days reasonably well. The goal is not rescuing every nap but sustaining the whole day.</strong></p>","faq":[{"question":"Do I need a much earlier bedtime after a short nap?","answer":"Not always. A modestly earlier bedtime may help, depending on how your child functions and what works for family life."},{"question":"Should I always try to extend a short nap?","answer":"No. You can try for a reasonable period and then shift toward a calmer afternoon if it does not work."},{"question":"Does a short nap mean there is a sleep problem?","answer":"Not necessarily. One nap gives little information; a repeated pattern over several days matters more."}],"sources":[],"image":{"concept":"Baby awake after a short nap while a parent shifts to a simple calm afternoon at home, natural light, no text.","alt":"Baby awake after a short nap with a parent"},"status":"publish"}