{"schema_version":2,"id":"es-053-primeras-semanas-recien-nacido-sin-horario-perfecto","article_number":53,"translation_group":"053-first-weeks-newborn-without-perfect-schedule","language":"es","locale":"es-ES","market_context":"Audiencia hispanohablante; enfoque práctico y cotidiano, sin consejo médico.","title":"Cómo organizar las primeras semanas con un recién nacido sin intentar crear un horario perfecto","slug":"primeras-semanas-recien-nacido-sin-horario-perfecto","seo":{"title":"Primeras semanas con un recién nacido: cómo organizarse","meta_description":"Cómo organizar suministros, relevos y pequeñas anclas del día con un recién nacido sin exigir un horario rígido ni una rutina perfecta.","search_intent":"Ofrecer una forma práctica de organizar las primeras semanas con un recién nacido sin exigir horarios rígidos."},"excerpt":"Con un recién nacido puede haber mucha repetición y poca previsibilidad. Organizar el entorno, los relevos y unas pocas anclas del día suele ser más útil que perseguir un horario perfecto.","taxonomy":{"topic":{"primary":"postpartum-newborn","terms":["postpartum-newborn"]},"stage":{"primary":"newborn","terms":["newborn"]},"audience":{"primary":"parents","terms":["parents"]},"article_type":{"primary":"routine-organization","terms":["routine-organization"]}},"content_html":"<p>Las primeras semanas con un recién nacido pueden ser muy repetitivas y, al mismo tiempo, nada previsibles. Alimentar, cambiar, sostener, calmar y volver a empezar ocupa buena parte del día, pero aun así resulta imposible saber cómo será exactamente la tarde. Esa contradicción explica por qué cuesta tanto “organizarse”: el trabajo se repite, pero la hora cambia constantemente.</p>\n<p>Un horario detallado intenta resolver muchas veces el problema equivocado. <strong>En vez de hacer predecible al bebé, conviene organizar a los adultos, el entorno y las decisiones que van a repetirse de todos modos.</strong> La meta no es conseguir un día perfecto, sino reducir fricción cuando inevitablemente el plan se mueva.</p>\n<h2>Organiza lo que se repite, no las horas a las que debería ocurrir</h2>\n<p>Observad qué hacéis varias veces al día y facilitadlo. Los pañales deben estar donde de verdad cambiáis al bebé, no únicamente en el lugar que parecía lógico antes del parto. Agua, cargador y algo fácil de comer pueden vivir cerca del sofá o sillón donde alguien pasa largos ratos atrapado bajo un bebé. Muselinas, biberones limpios u otros objetos de uso frecuente necesitan un sitio obvio que cualquiera pueda encontrar sin preguntar.</p>\n<p>Puede parecer una organización demasiado sencilla para contar como sistema, y esa es precisamente su ventaja. A las tres de la mañana ahorrar seis pequeñas búsquedas vale más que tener un cajón precioso. Una cesta portátil puede ser más útil que un organizador complejo si la familia pasa casi todo el día en el salón.</p>\n<p>Revisadlo después de unos días. Si siempre subís el mismo objeto de una planta a otra, quizá merece la pena duplicarlo. Si algo nunca se utiliza donde lo colocasteis, movedlo. La casa debe adaptarse a la vida que está apareciendo, no conservar intactas decisiones tomadas durante el embarazo.</p>\n<h2>Repartid responsabilidades antes de que ambos estéis agotados</h2>\n<p>Cuando hay dos adultos, “ya nos iremos ayudando” puede sonar justo y acabar exigiendo muchísima coordinación. Alguien tiene que darse cuenta de que no hay cena, faltan pañales, el cubo está lleno o hay que recoger algo. Resulta más fácil cuando ciertas áreas tienen un responsable, aunque el reparto cambie según el día.</p>\n<p>Uno puede ocuparse de la comida y otro de reponer suministros. Uno gestiona entregas y visitas durante una franja mientras el otro queda fuera de servicio. No hace falta que cada diez minutos estén repartidos al cincuenta por ciento; suele ser más útil proteger descansos y saber quién lleva qué sin esperar instrucciones.</p>\n<p>Una conversación de dos minutos puede aportar más que una aplicación sofisticada: ¿qué necesitas hoy?, ¿qué necesito yo?, ¿qué no podemos olvidar? Con poco sueño, incluso los acuerdos que parecen evidentes conviene decirlos.</p>\n<h2>El día de los adultos puede tener anclas aunque el bebé no tenga horario</h2>\n<p>Quizá no podéis decidir cuándo dormirá el bebé, pero sí intentar que existan algunos puntos de referencia. Alguien desayuna. Los dos tienen ocasión de ducharse. En algún momento se abren cortinas o se sale un rato si apetece. La cena tiene una solución por defecto. Por la noche la casa baja el ritmo aunque no exista una hora exacta de acostarse.</p>\n<p>Esas anclas no son promesas sobre el bebé. Evitan que el día entero se convierta en una cadena indistinguible de cuidados. Si hoy el desayuno ocurre a las ocho y media y mañana a las diez, sigue cumpliendo su función: recordar que los adultos también tienen cuerpo, necesidades y cierta estructura compartida.</p>\n<p>Elegid además planes que toleren interrupciones. Una tarea que puede dejarse a medias ncaja mejor que otra que requiere una hora garantizada. Un paseo sin objetivo rígido puede ser más fácil que tres recados cronometrados. Una visita que acepta una franja amplia suele generar menos presión que un plan que parece arruinado si vais cuarenta minutos tarde.</p>\n<h2>Distingue lo pendiente de lo urgente</h2>\n<p>Las primeras semanas crean una colección interminable de cosas abiertas: mensajes, agradecimientos, citas, fotos, ropa, papeles, compra, devoluciones, detalles de la habitación. Con cansancio, todo lo incompleto puede sonar igual de fuerte. Separar lo que afecta a hoy de lo que simplemente sigue pendiente reduce mucho ruido mental.</p>\n<p>Comer, tener suministros básicos o resolver una cita con fecha quizá sí necesite atención. Ordenar fotos, contestar todas las felicitaciones o terminar la decoración normalmente puede esperar. Si alguien ofrece ayuda, intentad convertirla en una tarea cerrada: traer cena el martes, recoger una compra, sacar al perro, devolver un paquete. La ayuda concreta quita coordinación en vez de generar otra conversación.</p>\n<p>Los registros y aplicaciones solo merecen quedarse si reducen memoria. Una nota compartida que evita preguntas repetidas puede ser estupenda. Un sistema que hace sentir que cada día es una desviación del plan se ha convertido en otra obligación.</p>\n<p><strong>Las primeras semanas no tienen que demostrar que ya domináis la vida con un bebé.</strong> Una organización suficientemente buena es mucho menos espectacular: encontráis lo que uséis, las responsabilidades están algo más claras, las necesidades de los adultos no desaparecen y un día extraño no significa que todo el sistema haya fallado.</p>","faq":[{"question":"¿Se puede hacer una rutina con un recién nacido?","answer":"Puede haber pequeñas anclas y secuencias familiares, pero no necesitas que cada día ocurra a las mismas horas. La estructura puede estar en cómo os organizáis los adultos."},{"question":"¿Cómo organizarse en casa las primeras semanas?","answer":"Facilita las tareas que se repiten, prepara suministros donde los usas, acuerda relevos y elige planes fáciles de interrumpir."},{"question":"¿Necesito registrar todo lo que hace el bebé?","answer":"No necesariamente. Un registro puede ser útil para algunas familias, pero no debería convertirse en una obligación que aumente la presión cotidiana."}],"sources":[],"image":{"concept":"Padres en casa con un recién nacido, uno prepara algo sencillo mientras el otro sostiene al bebé, elementos cotidianos organizados de forma práctica, ambiente realista y tranquilo.","alt":"Padres organizando el día en casa durante las primeras semanas con un recién nacido"},"status":"publish"}