{"schema_version":2,"id":"en-080-potty-refusal-avoid-power-struggle","article_number":80,"translation_group":"080-potty-refusal-avoid-power-struggle","language":"en","locale":"en-US","market_context":"U.S./Canada audience; practical potty-training and autonomy guidance without medical advice.","title":"Refusing to sit on the potty: how to avoid a power struggle","slug":"potty-refusal-avoid-power-struggle","seo":{"title":"Won’t sit on the potty? Avoid the power struggle","meta_description":"What to do when a toddler refuses the potty: reduce pressure, review the setup, and keep boundaries without turning bathroom practice into a contest.","search_intent":"Help parents respond when a child refuses to sit on the potty without increasing resistance through pressure or power struggles."},"excerpt":"When every potty invitation gets an immediate no, the issue is no longer only learning a new routine. The bathroom can start to represent loss of control. Lowering pressure is not giving up; it is making room for cooperation again.","taxonomy":{"topic":{"primary":"potty-hygiene-autonomy","terms":["potty-hygiene-autonomy","potty-training"]},"stage":{"primary":"toddler","terms":["toddler","preschool"]},"audience":{"primary":"parents","terms":["parents"]},"article_type":{"primary":"everyday-problem","terms":["everyday-problem","communication-boundaries"]}},"content_html":"<p>“Let’s sit for a minute.” “No.” Before leaving: no. Before bath: no. After dinner: no. Within a few days, the potty itself can become a cue for resistance before your child has even considered whether they need to use it.</p><p><strong>Once sitting becomes a contest, asking more often does not necessarily create more learning.</strong> It can strengthen the connection between the bathroom and an adult trying to control what happens to the child’s body. The useful task is to separate the skill from the struggle again.</p><h2>Work out which part of the routine your child is actually resisting</h2><p>“I don’t want the potty” can cover several different problems. Your child may not want to stop playing, may dislike being watched, may find the seat uncomfortable, prefer the toilet, dislike clothing changes, or simply not understand why they are being asked to sit when they feel no urge.</p><p>Watch when the refusal appears. A child who sits willingly when it is their idea but rejects every adult invitation may be protecting control more than rejecting the bathroom itself. A child who avoids every toilet, every potty, and every unfamiliar restroom may need more time to make the environment ordinary.</p><p>You do not need to question them until you obtain a perfect explanation. Try changing one variable at a time: location, seat, privacy, timing, or how much you talk about it. The response can tell you more than a long conversation.</p><p>Also count how often the potty is being mentioned. A process that began with reasonable reminders can quietly become the dominant topic of the day. <strong>If every transition includes a bathroom negotiation, the child may start resisting the invitation before noticing their own body at all.</strong></p><h2>Use fewer invitations and make them easier to predict</h2><p>Instead of asking repeatedly, choose a few moments that naturally fit your day: after waking, before leaving home, before bath, or another transition where a bathroom opportunity makes sense. Predictability reduces the sense that an adult is monitoring the child continuously.</p><p>If they say no in a situation where waiting is reasonable, you can let the answer stand: “Okay, we’ll try later.” That does not mean adults never make logistical decisions. Before a long drive, for example, you can explain that there will not be easy bathroom access for a while and offer one clear opportunity.</p><p>Try not to disguise pressure as a question. “Do you want to sit?” followed by repeated persuasion after the child says no teaches that the question was not really a choice. If the bathroom trip is necessary for a practical reason, say that more directly; if it is optional, allow the option to be real.</p><p><strong>Being able to say no sometimes can make later yeses feel more like cooperation and less like surrender.</strong></p><h2>Reduce the emotional weight around successful sits</h2><p>When refusal worries adults, the potty can acquire a huge amount of attention: bigger rewards, enthusiastic celebrations, repeated praise, visible disappointment, and constant updates to other family members. That intensity can make the bathroom feel like a performance.</p><p>Some children respond better when success becomes ordinary. “You peed in the potty. Let’s wash hands” can be enough. If your child likes a short book while sitting, use one; you do not need to create twenty minutes of entertainment to keep them there.</p><p>If they stand immediately, physically holding them down or blocking them from leaving usually makes the conflict larger than the skill you were trying to teach. A brief unsuccessful sit can end without becoming a failed session.</p><p>Keep connection available outside bathroom performance. Attention, warmth, and approval should not become something the child earns by producing pee or poop on command.</p><h2>Know when reducing pressure or pausing gives the process room again</h2><p>If the child cries at the sight of the potty, runs away every time it is mentioned, or the family spends large parts of the day bargaining about sitting, the process may need less intensity. The potty can stay available without remaining a constant assignment.</p><p>A pause does not delete previous learning. Clothing skills, body awareness, communication, and familiarity can continue developing. When you return, you can change the setup rather than simply restarting the same conflict with more determination.</p><p>During a pause, avoid presenting it as defeat or as a warning that “we’ll try again when you’re ready to cooperate.” Simply let the bathroom become ordinary again. The objective is a usable life skill, not winning a timetable.</p><p><strong>Potty training is not successful because an adult finally persuades a child to sit. It becomes useful when the child gradually recognizes a need, knows what the bathroom is for, and can participate in the routine with increasing ownership. Protecting that sense of ownership is often more valuable than winning one more sit today.</strong></p>","faq":[{"question":"What should I do if my child says no every time I suggest the potty?","answer":"Ask less often and use a few predictable moments. When saying no is allowed in reasonable situations, the bathroom can lose some of its power-struggle feeling."},{"question":"Should I make my child sit for a few minutes?","answer":"Physically forcing the sit often increases resistance. It is usually more useful to review what they dislike, adjust the setup, and offer calmer opportunities."},{"question":"When does a potty training pause make sense?","answer":"If the potty triggers intense refusal or the family spends much of the day negotiating about the bathroom, a pause can reduce tension and make a later restart easier."}],"sources":[],"image":{"concept":"Toddler standing beside a potty while an adult stays nearby with relaxed body language and does not try to force sitting, warm realistic family bathroom, no text.","alt":"Adult avoiding a power struggle when a toddler refuses to sit on the potty"},"status":"publish"}