{"schema_version":2,"id":"es-148-horarios-sueno-otras-familias-no-tienen-funcionar","article_number":148,"translation_group":"148-other-families-sleep-schedules-may-not-fit-yours","language":"es","locale":"es-ES","market_context":"Audiencia hispanohablante; adaptación de horarios de sueño al contexto familiar.","title":"Por qué los horarios de sueño de otras familias no tienen que funcionar en la tuya","slug":"horarios-sueno-otras-familias-no-tienen-funcionar","seo":{"title":"Por qué el horario de sueño de otra familia puede no funcionar en la tuya","meta_description":"Un horario de sueño puede ser excelente para otra familia y mal encaje para la tuya. Aprende a valorar trabajo, hermanos, siestas y vida real antes de copiarlo.","search_intent":"Ayudar a familias a adaptar horarios de sueño a su propio contexto en vez de copiar rutinas ajenas."},"excerpt":"Un horario puede parecer ideal desde fuera y fracasar en tu casa porque el sueño no ocurre aislado: convive con trabajo, escuela, hermanos, comidas y energía familiar.","taxonomy":{"topic":{"primary":"sleep","terms":["sleep"]},"stage":{"primary":"baby","terms":["baby","toddler","preschool","school-age"]},"audience":{"primary":"parents","terms":["parents"]},"article_type":{"primary":"understanding","terms":["understanding"]}},"content_html":"<p>Es tentador copiar el horario que otra familia describe como “lo que por fin funcionó”: siesta a tal hora, cena a otra y cama exactamente después. Un plan concreto reduce incertidumbre, pero también puede ocultar algo importante: ese horario fue diseñado —consciente o inconscientemente— alrededor de otra casa.</p><p><strong>El mejor horario no es el más ordenado sobre el papel, sino el que puede convivir con vuestra vida real.</strong></p><h2>El reloj solo muestra una parte del sistema</h2><p>Una hora de dormir depende de cuándo termina daycare, cuándo llega un cuidador, si hay hermanos con actividades, cómo se organiza la cena y cuánto tarda la transición nocturna. Copiar solo la hora final sin esas variables puede hacer que todo el tramo anterior sea una carrera.</p><h2>La misma estructura puede necesitar otro horario</h2><p>Tal vez te sirva la idea de una secuencia estable —cena, baño, cuento, descanso— sin adoptar las mismas horas. Separar estructura de reloj permite aprender de otras familias sin tratar su agenda como prescripción.</p><h2>Evalúa los efectos durante varios días reales</h2><p>Un horario nuevo puede parecer perfecto un domingo tranquilo y desmoronarse el martes con trabajo y recogidas. Valóralo en días normales: ¿obliga a correr?, ¿reduce o aumenta conflicto?, ¿es compatible con siestas y con el resto de la familia?</p><h2>No conviertas la diferencia en un defecto</h2><p>Si vuestro hijo se duerme más tarde o hace una siesta distinta que el hijo de un amigo, esa diferencia por sí sola no prueba que algo esté mal. Si tienes dudas sobre salud o necesidades de sueño, consúltalas con el profesional que conoce al niño; las comparaciones sociales no sustituyen esa valoración.</p><p>En lo cotidiano, el objetivo es un ritmo suficientemente predecible para orientar a la familia y suficientemente flexible para pertenecer a vuestra vida.</p>","faq":[{"question":"¿Puedo usar el horario de otra familia como referencia?","answer":"Sí, como idea. Conviene adaptar la estructura a vuestro trabajo, siestas, hermanos y transiciones reales."},{"question":"¿Tengo que mantener exactamente la misma hora cada día?","answer":"No necesariamente. Muchas familias funcionan mejor con una ventana razonable y una secuencia reconocible."},{"question":"¿Y si me preocupa que mi hijo duerma demasiado poco o demasiado?","answer":"Las dudas sobre necesidades de sueño o salud conviene comentarlas con un profesional que conozca al niño, no resolverlas comparando horarios ajenos."}],"sources":[],"image":{"concept":"Familia organizando su propia tarde con reloj, cena y rutina infantil sin rigidez, escena doméstica, sin texto.","alt":"Familia adaptando un horario de sueño a su propia vida"},"status":"publish"}