{"schema_version":2,"id":"es-058-que-comprar-antes-nazca-bebe-que-puede-esperar","article_number":58,"translation_group":"058-what-to-buy-before-baby-and-what-can-wait","language":"es","locale":"es-ES","market_context":"Audiencia hispanohablante; enfoque práctico y cotidiano, sin consejo médico.","title":"Qué comprar antes de que nazca el bebé y qué puede esperar","slug":"que-comprar-antes-nazca-bebe-que-puede-esperar","seo":{"title":"Qué comprar antes de que nazca el bebé y qué puede esperar","meta_description":"No necesitas tener resueltos los primeros seis meses antes del parto. Cómo distinguir los básicos iniciales de las compras que es mejor decidir cuando conozcáis vuestra rutina.","search_intent":"Ayudar a futuros padres a priorizar compras antes del nacimiento y posponer lo que depende de preferencias o necesidades que aún no conocen."},"excerpt":"Prepararse para un bebé no consiste en anticipar cada objeto de los próximos meses. Una base para dormir, vestir, transportar, alimentar y cuidar el día a día puede estar lista; muchas otras compras mejoran cuando se hacen con información real.","taxonomy":{"topic":{"primary":"potty-hygiene-autonomy","terms":["potty-hygiene-autonomy"]},"stage":{"primary":"preparing-for-baby","terms":["preparing-for-baby"]},"audience":{"primary":"parents","terms":["parents"]},"article_type":{"primary":"checklist-preparation","terms":["checklist-preparation"]}},"content_html":"<p>Preparar la llegada de un bebé puede hacer que casi cualquier producto parezca urgente. Una tienda, una lista de nacimiento o las redes convierten objetos cotidianos en cosas que supuestamente deberías tener resueltas antes del parto, y de pronto los últimos meses del embarazo parecen una fecha límite para organizar el primer año entero.</p><p>Una forma más tranquila de prepararse es separar dos preguntas: <strong>¿qué necesitamos para recibir al bebé y funcionar durante los primeros días? y ¿qué podremos elegir mejor cuando conozcamos al bebé real, nuestra casa y nuestra rutina?</strong></p><h2>Prepara el comienzo, no todas las etapas futuras</h2><p>Antes del nacimiento tiene sentido cubrir lo que utilizaréis desde el principio: una forma adecuada de transportar al bebé, un espacio de descanso preparado según las recomendaciones de seguridad que sigáis, pañales y cuidados básicos, una pequeña rotación de ropa y los elementos de alimentación que formen parte de vuestro plan inicial.</p><p>La meta no es poseer todos los productos posibles para un recién nacido. Es evitar volver a casa y descubrir que falta algo básico que obliga a hacer una compra urgente.</p><p>Eso es muy distinto de equipar de antemano los seis meses siguientes. Tronas, juguetes de etapas posteriores, utensilios de alimentación complementaria, ropa de muchas tallas o sistemas de organización específicos pueden ser útiles más adelante. No necesitan ocupar dinero y espacio antes de saber si encajan con vuestra familia.</p><p>Una pregunta sencilla ayuda a ordenar prioridades: imagina la primera semana sin ese objeto. ¿Su ausencia impide cubrir una necesidad cotidiana o simplemente haría una tarea menos cómoda? Las dos categorías pueden justificar una compra, pero no tienen la misma urgencia.</p><h2>Distingue necesidad, comodidad y experimento</h2><p>Muchas listas de nacimiento ponen todo al mismo nivel, y así un accesorio opcional puede parecer tan imprescindible como una forma segura de transportar al bebé. Reordenar la lista cambia bastante la sensación de presión.</p><p>En “necesidad” pueden quedar los básicos que utilizaréis desde el inicio. “Comodidad” recoge cosas que quizá faciliten la rutina si el presupuesto y el espacio lo permiten. “Quizá” sirve para productos cuyo valor depende de preferencias que todavía no tenéis.</p><p>Esta última categoría suele ser más grande de lo que parece. Portabebés, accesorios del carrito, sistemas de biberones, complementos de extracción, mantas específicas, organizadores y aparatos para calmar al bebé generan opiniones muy distintas porque las familias los usan de maneras muy distintas.</p><p>Esperar ante una compra dudosa no es falta de preparación. Es permitir que la experiencia participe en la decisión. Cuando sepáis qué tarea se repite y os incomoda, en qué habitación pasáis más tiempo, qué tolera el bebé y qué resulta fácil para otros cuidadores, será mucho más sencillo elegir qué comodidad merece la pena.</p><h2>Haz inventario antes de comprar duplicados</h2><p>Regalos, préstamos y ropa o material heredado pueden cambiar por completo lo que realmente hace falta comprar. Antes de duplicar productos, conviene saber qué llegará a casa y si queréis dos unidades de verdad.</p><p>Para algunas cosas, la segunda mano o el préstamo funcionan estupendamente. Para otras preferiréis comprar nuevo por estado, ajuste, higiene, información de seguridad actual o simplemente por comodidad personal. La idea no es que todo tenga que ser prestado, sino que comprar no sea una reacción automática antes de conocer lo que ya tenéis disponible.</p><p>El espacio también cuenta. Los productos grandes tienen un coste que no aparece en el precio: ocupan metros, necesitan guardarse y añaden mantenimiento mental. Una casa llena de soluciones para rutinas imaginadas puede acabar obligando a la familia a adaptarse a las compras, en lugar de que las compras ayuden a la familia.</p><p>Dejar un hueco libre también es preparación. Reservar parte del presupuesto, también. La flexibilidad tiene valor cuando vuestra principal fuente de información —el bebé y la vida que construiréis alrededor— todavía no ha llegado.</p><h2>Organiza la opción de comprar después sin convertir cada necesidad en una emergencia</h2><p>“Ya lo compraremos” tranquiliza más cuando comprar después es razonablemente fácil. Puede ser útil guardar una pequeña lista de segunda fase con enlaces, tallas o modelos que os gustan, sin adquirirlos todavía. Así, si aparece una necesidad real, parte de la decisión ya está pensada.</p><p>También podéis identificar qué cosas serían fáciles de pedir prestadas unos días, comprar cerca de casa o probar gracias a otra familia. La primera solución a un problema no tiene que convertirse necesariamente en una compra definitiva.</p><p>Y conviene recordar algo muy básico: las tiendas seguirán existiendo después del nacimiento. También las entregas, devoluciones, préstamos y recomendaciones de otras familias basadas en uso real. No hace falta gastar antes de tener toda la información.</p><p><strong>Una casa preparada no es una casa que contiene cada producto que quizá sirva algún día. Es una casa capaz de sostener el comienzo y que conserva suficiente espacio —físico, económico y mental— para adaptarse cuando empiece la vida familiar real.</strong></p>","faq":[{"question":"¿Qué es imprescindible comprar antes de que nazca el bebé?","answer":"Conviene tener cubiertos los primeros días: transporte, descanso, pañales e higiene básica, una pequeña cantidad de ropa y lo necesario para el plan de alimentación inicial."},{"question":"¿Qué compras del bebé pueden esperar?","answer":"Los accesorios que dependen de preferencias, rutinas o etapas posteriores suelen poder decidirse mejor después de conocer al bebé y vuestra vida cotidiana."},{"question":"¿Es mala idea no tener todo comprado antes del parto?","answer":"No. Tener una base funcional es suficiente para muchas familias. Dejar compras para después puede reducir gasto y permitir decisiones mejor informadas."}],"sources":[],"image":{"concept":"Futuros padres revisando una pequeña selección de básicos de bebé en una habitación todavía sencilla, cajas sin exceso y ambiente tranquilo, sin marcas ni texto.","alt":"Pareja preparando solo los básicos necesarios antes del nacimiento"},"status":"publish"}