{"schema_version":2,"id":"es-1043-presion-crear-recuerdos-especiales-hijos","article_number":1043,"translation_group":"1043-pressure-to-create-special-memories-for-kids","language":"es","locale":"es-ES","market_context":"Audiencia hispanohablante; presión parental, recuerdos familiares y vida cotidiana, sin enfoque clínico.","title":"La presión de crear recuerdos especiales constantemente para tus hijos","slug":"presion-crear-recuerdos-especiales-hijos","seo":{"title":"La presión de crear recuerdos especiales para tus hijos","meta_description":"Por qué intentar convertir cada fin de semana, cumpleaños o vacaciones en un recuerdo perfecto puede agotar a los padres y cómo valorar más lo cotidiano.","search_intent":"Responder a madres y padres que sienten presión por crear experiencias memorables constantemente para sus hijos."},"excerpt":"Los recuerdos infantiles no se fabrican únicamente con viajes, decoraciones y planes especiales. Muchas veces se construyen alrededor de cosas pequeñas que nadie preparó para que fueran memorables: una canción en el coche, una cena repetida o una tarde cualquiera en casa.","taxonomy":{"topic":{"primary":"motherhood-identity","terms":["motherhood-identity","celebrations"]},"stage":{"primary":"parenthood-general","terms":["parenthood-general","toddler","preschool","school-age"]},"audience":{"primary":"parents","terms":["mothers","fathers","parents"]},"article_type":{"primary":"emotions-identity","terms":["emotions-identity"]}},"content_html":"<p>Hay una forma de presión parental que parece especialmente bonita porque viene envuelta en luces, manualidades, viajes y fotos.</p><p>“Solo tienen una infancia.”</p><p>“Haz recuerdos.”</p><p>“Algún día echarás de menos estas Navidades.”</p><p>El mensaje puede terminar convirtiendo cada cumpleaños, fin de semana y vacaciones en un proyecto que hay que producir.</p><p><strong>Crear recuerdos no debería significar vivir como si fueras la directora creativa de la infancia de tus hijos.</strong></p><h2>Los niños no recuerdan todo lo que los adultos preparan</h2><p>Puedes pasar tres horas decorando una fiesta y que tu hijo recuerde el momento en que jugó debajo de una mesa con su primo.</p><p>Puedes organizar unas vacaciones perfectas y que años después hable únicamente del helado que se derritió.</p><p>Los recuerdos no siguen necesariamente el presupuesto ni el esfuerzo que invertiste.</p><h2>Lo cotidiano también se convierte en memoria</h2><p>La misma canción camino al colegio. Un desayuno de domingo. Cómo olía la casa de los abuelos. Una frase que repetíais. La forma en que te sentabas a su lado cuando estaba triste.</p><p>Muchos recuerdos familiares importantes nacen de la repetición y del ambiente, no de acontecimientos extraordinarios.</p><p>Eso puede ser un alivio.</p><h2>Las redes sociales han cambiado lo que parece “suficiente”</h2><p>Antes podías hacer una tarde de galletas.</p><p>Ahora puedes ver veinte versiones con pijamas coordinados, decoración temática, bandejas especiales y fotografías perfectas.</p><p>El problema no es que alguien disfrute haciendo todo eso.</p><p>El problema aparece cuando una actividad sencilla empieza a parecer pobre porque has visto una producción completa.</p><h2>No todos los fines de semana tienen que contener un plan</h2><p>Una infancia también necesita días sin grandes acontecimientos.</p><p>Días de parque, de quedarse en casa, de aburrirse un poco y de acompañar a los adultos a hacer cosas normales.</p><p>El tiempo vacío no es tiempo perdido.</p><p>Puede ser precisamente donde aparecen juegos e historias que nadie había programado.</p><h2>Pregúntate para quién estás preparando la experiencia</h2><p>¿Tu hijo realmente disfruta ese tipo de plan? ¿Tú disfrutas preparándolo? ¿O sientes que es algo que una “buena madre” debería hacer?</p><p>No hay nada malo en organizar una fiesta enorme si te hace ilusión.</p><p>Pero es diferente elegirla por placer que hacerla desde la culpa.</p><h2>Documentar no es lo mismo que vivir</h2><p>Las fotos son maravillosas.</p><p>También puede ocurrir que pases tanto tiempo intentando capturar el recuerdo que apenas estés dentro de él.</p><p>No necesitas fotografiar cada actividad para que haya sucedido.</p><p>Y tus hijos no necesitan una prueba visual de cada día bonito.</p><h2>Las tradiciones funcionan mejor cuando son sostenibles</h2><p>Una tradición que requiere dos semanas de preparación quizá termine convirtiéndose en una carga que solo una persona sostiene.</p><p>Las mejores tradiciones familiares muchas veces son fáciles de repetir: una comida, un paseo, una película, una forma de celebrar el cumpleaños al despertar.</p><p>Si puedes mantenerla sin resentimiento, tiene más posibilidades de durar.</p><h2>Los recuerdos no dependen solo de lo que hiciste</h2><p>También dependen de cómo se sentía estar en casa.</p><p>Un niño puede recordar que los sábados eran tranquilos, que había risas en la cocina o que siempre podía sentarse contigo.</p><p>Ese tipo de memoria no se compra ni se organiza en Pinterest.</p><h2>Puedes elegir menos cosas y disfrutarlas más</h2><p>En lugar de intentar hacer diez actividades navideñas, quizá vuestra familia disfruta dos.</p><p>En lugar de llenar las vacaciones, podéis dejar tardes libres.</p><p>Reducir no significa dar menos infancia. Puede significar dar una infancia con adultos menos agotados.</p><h2>No necesitas producir una infancia memorable</h2><p>Tus hijos ya están viviendo una.</p><p>No recordarás todos los días. Ellos tampoco.</p><p>Eso no convierte los días ordinarios en irrelevantes.</p><p><strong>Los recuerdos familiares suelen crecer donde hay repetición, atención y vida compartida. No necesitan que conviertas cada momento en especial para que, con el tiempo, algunos terminen siéndolo.</strong></p>","faq":[{"question":"¿Tengo que hacer planes especiales todos los fines de semana con mis hijos?","answer":"No. Los días ordinarios, el juego libre y las rutinas familiares también forman parte de la infancia y pueden convertirse en recuerdos importantes."},{"question":"¿Qué recuerdan más los niños de su infancia?","answer":"No puedes controlar qué momentos quedarán. Muchos recuerdos se forman alrededor de rutinas, sensaciones, relaciones y detalles cotidianos, no solo de grandes planes."},{"question":"¿Cómo crear tradiciones familiares sin agotarme?","answer":"Elige pocas cosas sencillas que realmente disfrutéis y que puedan repetirse sin una gran carga de preparación."}],"sources":[],"image":{"concept":"Familia con niños compartiendo una tarde cotidiana sencilla en casa, riendo alrededor de una mesa sin decoración elaborada, ambiente natural y realista, sin texto.","alt":"Familia creando recuerdos cotidianos en una tarde sencilla en casa"},"status":"publish"}
