{"schema_version":2,"id":"es-1091-otras-madres-parecen-llevarlo-mejor","article_number":1091,"translation_group":"1091-other-moms-seem-to-handle-everything-better","language":"es","locale":"es-ES","market_context":"Audiencia hispanohablante; experiencia emocional de la maternidad y comparación social, sin diagnóstico ni tratamiento.","title":"Sentir que otras madres parecen llevarlo todo mejor que tú","slug":"otras-madres-parecen-llevarlo-mejor","seo":{"title":"Cuando otras madres parecen llevarlo todo mejor que tú","meta_description":"Por qué otras madres pueden parecer más tranquilas, organizadas o capaces desde fuera y cómo dejar de comparar su escaparate con tu trastienda cotidiana.","search_intent":"Ayudar a madres que sienten que otras llevan la maternidad mejor a entender la asimetría de la comparación y recuperar una medida más justa."},"excerpt":"Tú ves tus mensajes sin contestar, el enfado de esta mañana y la ropa acumulada. De la otra madre ves que llegó puntual, recordó la merienda y sonrió en la puerta. La comparación empieza con información desigual y luego pretende emitir una sentencia completa.","taxonomy":{"topic":{"primary":"motherhood-identity","terms":["motherhood-identity"]},"stage":{"primary":"parenthood-general","terms":["parenthood-general"]},"audience":{"primary":"mothers","terms":["mothers"]},"article_type":{"primary":"emotions-identity","terms":["emotions-identity"]}},"content_html":"<p>Hay días en los que basta una escena pequeña para que aparezca una conclusión enorme. Llegas tarde al colegio, con una botella que no era la correcta y dos mensajes sin contestar, y al lado ves a otra madre que recuerda la excursión, lleva la merienda preparada y parece hablar con calma. En pocos segundos, tu cabeza deja de describir una escena y empieza a construir una jerarquía: ella puede con todo; yo voy siempre por detrás.</p><p><strong>El problema no es admirar una capacidad ajena. El problema es comparar tu vida completa, conocida desde dentro, con una parte visible de otra vida y tratar esa comparación como si fuera una evaluación objetiva.</strong></p><h2>Tu maternidad te llega sin editar; la ajena te llega resumida</h2><p>Tú conoces el desayuno que terminó en discusión, la cita que olvidaste, las tres veces que repetiste una instrucción y el momento en que contestaste peor de lo que querías. También sabes qué llevas pendiente del trabajo, cuánto has dormido y qué preocupación familiar te ocupa por dentro. De la otra madre quizá conoces veinte minutos en una puerta, una conversación de parque y algunas fotos.</p><p>Esa diferencia de información importa. No necesitas asumir que ella oculta una vida desastrosa para equilibrar la balanza. Puede ser realmente puntual, paciente o previsora. Lo que no puedes saber a partir de esa fortaleza es cómo funciona el resto de su semana, qué apoyo tiene, qué le cuesta a ella o qué áreas ha decidido simplificar.</p><p>La comparación suele cometer un salto silencioso: de “hoy hizo esto mejor que yo” a “ella lleva la maternidad mejor”. La primera frase puede ser cierta. La segunda necesita cientos de datos que no tienes.</p><h2>“Llevarlo mejor” mezcla capacidades que no siempre viven en la misma persona</h2><p>Cuando te sientes por debajo, tu cabeza empieza a recoger pruebas muy deprisa. Una madre cocina mucho; otra nunca olvida fechas; otra parece disfrutar el juego; otra tiene la casa ordenada; otra viaja con los niños sin aparente caos. Sin darte cuenta, esas personas distintas se convierten en una sola figura imaginaria que trabaja, organiza, cocina, juega, descansa y jamás pierde la paciencia.</p><p>Esa figura es difícil de cuestionar porque no existe en un lugar concreto donde puedas ver sus límites. Es un collage de resultados. Y tú, en cambio, sí tienes que vivir con todas las compensaciones de una vida real: el tiempo que dedicas a una cosa sale de otra, la energía baja, los niños cambian, hay semanas malas y no todos los recursos están disponibles a la vez.</p><p>Una forma útil de frenar ese collage es nombrar a la persona y la capacidad concreta: “Marta parece muy buena anticipando cosas del colegio”. Eso permite aprender algo. “Todas las demás lo hacen mejor que yo” no permite aprender nada porque transforma diferencias específicas en una identidad inferior.</p><h2>La punzada de comparación puede contener información útil</h2><p>A veces la envidia señala algo que sí necesitas. Quizá no quieres ser “como ella”; quieres que alguien comparta las tardes. Quizá admiras que protege una noche para sí misma, que tiene un sistema simple para las comidas o que no acepta tres compromisos el mismo fin de semana. El dato útil está en el detalle, no en la sentencia sobre tu valor.</p><p>Prueba a preguntar: “¿Qué parte exacta de esto me gustaría que fuera más fácil en nuestra casa?”. Tal vez la respuesta sea más ayuda, menos compromisos, un calendario compartido, duplicados en el coche o bajar un estándar. A veces incluso descubrirás que no quieres el resultado al precio que exige. Una casa muy ordenada puede no ser prioridad suficiente para dedicarle las horas que otra familia dedica.</p><p>Convertir comparación en curiosidad cambia la dirección. Ya no necesitas demostrar que eres tan buena como nadie. Solo decidir si hay una idea que merece ser probada en tu contexto.</p><h2>Devuelve la evaluación a tu propia vida</h2><p>Cuando la comparación se vuelve global, busca una línea de base que sí conozcas. ¿Hay algo que ahora manejas mejor que hace seis meses? ¿Habéis reducido un conflicto repetido? ¿Pides ayuda antes? ¿Reparas con más claridad después de perder la paciencia? ¿Una rutina que antes exigía veinte recordatorios ahora funciona con cinco?</p><p>Ese tipo de evidencia suele ser menos vistosa que la escena de otra madre en la puerta del colegio, pero es mucho más válida para evaluar tu progreso. También incluye cosas que otras personas no ven: conversaciones difíciles que sostienes, decisiones que anticipas, límites que mantienes, momentos en los que cambias de estrategia porque tu hijo necesita otra cosa.</p><p>Y cuando otra madre haga algo realmente bien, puedes dejar que eso sea verdad sin convertirlo en una acusación. “Ella lo resolvió muy bien” y “yo también soy una madre competente con áreas difíciles” pueden coexistir.</p><p><strong>No necesitas convencerte de que todas las demás están igual de desbordadas para sentirte mejor. Basta con dejar de tratar una ventana parcial a otra vida como si fuera un informe completo sobre la tuya.</strong></p>","faq":[{"question":"¿Es normal compararse constantemente con otras madres?","answer":"La comparación social es común, especialmente cuando estás aprendiendo un rol con pocas medidas claras. El problema aparece cuando conviertes escenas parciales en conclusiones globales sobre tu valor como madre."},{"question":"¿Cómo puedo usar una comparación de forma útil?","answer":"Pregunta qué elemento concreto te atrae: un sistema, apoyo, límite o hábito. Puedes aprender de una parte de otra familia sin convertir a esa familia en una nota para la tuya."},{"question":"¿Qué hago cuando siento que todas pueden menos yo?","answer":"Reduce la frase a hechos observables y recuerda qué información no tienes. Después mira tu carga real y qué apoyo o cambio concreto podría aliviarla."}],"sources":[],"image":{"concept":"Madre observando a otras familias en la puerta de una escuela mientras sostiene una mochila, expresión reflexiva y cotidiana, sin dramatismo ni texto.","alt":"Madre comparándose con otras madres que parecen llevarlo todo mejor"},"status":"publish"}
